{
  "eventSchemaVersion": 1,
  "eventId": "evt_interrupted_001",
  "runId": "run_interrupted_01",
  "sequence": 3,
  "occurredAt": "2026-08-06T12:00:02.000Z",
  "type": "step_attempt_failed",
  "data": {
    "nodeId": "a",
    "attempt": 1,
    "invocationId": "inv_interrupted_01",
    "failure": {
      "kind": "interrupted",
      "code": "WOML_STEP_INTERRUPTED",
      "message": "Recovery found a started attempt without a terminal event."
    }
  }
}
